No,Soal,Opsi,Kunci
1,"Apa yang menjadi keistimewaan Al-Qur'an dibandingkan dengan kitab-kitab sebelumnya?","Merupakan wahyu Allah Swt. yang diturunkan kepada semua Nabi dan Rasul-Nya.;Berisi ajakan tauhid dan menghapus sebagian ajaran di Kitab Taurat.;Merupakan kitab pertama yang diturunkan Allah Swt. dan menghapus kitab-kitab terdahulu beserta ajarannya.;Berisi peringatan, nasihat, dan penyempurna kitab-kitab sebelumnya;Berisi penjelasan kebenaran dan kabar gembira akan datangnya Nabi terakhir","Berisi peringatan, nasihat, dan penyempurna kitab-kitab sebelumnya"
2,"Iman kepada rasul-rasul Allah berarti kalian percaya bahwa Allah mengutus rasul-rasul-Nya sebagai teladan dan contoh bagi manusia. Apa yang dimaksud dengan iman kepada rasul-rasul Allah?","Percaya bahwa rasul adalah contoh buruk;Tidak percaya bahwa rasul diutus oleh Allah;Tahu bahwa rasul hanya manusia biasa;Percaya bahwa rasul adalah teladan dan contoh","Percaya bahwa rasul adalah teladan dan contoh"
3,"Bacaan dari huruf yang berwarna orange yaitu………..","Gambar Tanpa Teks;Ikhfa;Idzhar;Idgham Bila Ghunnah;Idgham Bi Ghunnah","Idgham Bila Ghunnah"
4,"Apa perbedaan utama antara qaḍa dan kadar?","Semua jawaban salah.;Qaḍa tidak bisa diubah oleh usaha manusia, sedangkan kadar bisa diubah melalui usaha manusia.;Qaḍa terjadi secara tiba-tiba, sedangkan kadar sudah ditentukan sejak lama.;Qaḍa adalah perwujudan takdir yang sudah terjadi, sedangkan kadar adalah ketetapan yang belum terjadi.;Qaḍa adalah ketetapan yang terjadi sebelum manusia dilahirkan, sedangkan kadar terjadi setelah manusia lahir","Qaḍa tidak bisa diubah oleh usaha manusia, sedangkan kadar bisa diubah melalui usaha manusia"
5,"Dari 25 Rasul, ada 5 Rasul pilihan Alloh yang mempunyai keteguhan hati. 5 Rasul itu diberi julukan …..","Wali;Ulul Azmi;Ulil Amri;Asmaul Husna","Ulul Azmi"
6,"Apa yang menjadi salah satu jasa-jasa Khalifah Uṡman bin Affan yang paling terkenal dalam sejarah Islam?","Memperbaiki Masjid Nabawi.;Memperluas wilayah kekuasaan Islam.;Menata administrasi negara.;Mengumpulkan musḥaf Al-Qur'an yang standar.;Membentuk angkatan laut yang kuat","Mengumpulkan musḥaf Al-Qur'an yang standar"
7,"Huruf di samping berjumlah 6, adalah huruf dari bacaan","Gambar Tanpa Teks;Idzhar;Idgham Bi Ghunnah;Ikhfa;Idgham Bila Ghunnah","Idgham Bi Ghunnah"
8,"Salah satu yang harus diperhatikan ketika membaca Al-Qur'an adalah Makharijul huruf, agar tidak berubah arti dari ayat tersebut. Arti dari Makharijul huruf adalah ....","tempat keluarnya huruf;bentuk-bentuk huruf;hukum tajwid;panjang pendeknya huruf","tempat keluarnya huruf"
9,"Berdasarkan pembelajaran yang telah Anda terima, apa yang dimaksud dengan lingkungan biotik?","Lingkungan yang mencakup segala sesuatu yang bernyawa atau tempat hidup makhluk organik.;Lingkungan yang tidak memberikan pengaruh pada aktivitas manusia.;Lingkungan yang terdiri dari benda mati seperti tanah dan batu.;Lingkungan yang berisi hewan dan tumbuhan.;Lingkungan yang tidak terpengaruh oleh kehidupan manusia","Lingkungan yang mencakup segala sesuatu yang bernyawa atau tempat hidup makhluk organik"
10,"Apa hikmah dari berbakti kepada guru?","Memperoleh ilmu yang bermanfaat.;Menjadi pribadi yang tulus.;Mendapatkan kemuliaan di sisi Allah Swt.;Keridaan guru merupakan kunci sukses.;Semua jawaban benar","Semua jawaban benar"
11,"Rani adalah seorang siswa yang sangat pintar di kelasnya. Hari ini, Rani dan teman-temannya memiliki perbedaan pendapat tentang cara menyelesaikan masalah matematika. Apa yang harus Rani lakukan?","Mendengarkan pendapat teman-temannya dan mencari solusi bersama-sama.;Meninggalkan teman-temannya untuk mencari jawaban sendiri.;Menghindari teman-temannya karena tidak setuju dengan pendapatnya.;Memaksa teman-temannya untuk mengikuti pendapatnya","Mendengarkan pendapat teman-temannya dan mencari solusi bersama-sama"
12,"Saat sedang bermain bersama teman-temannya, Aisyah secara tidak sengaja menyakiti perasaan salah seorang temannya dengan sebuah komentar yang tidak sensitif. Bagaimana Aisyah dapat menunjukkan kesungguhan dalam bertaubat menurut syarat-syarat taubat nasuha?","Menyalahkan teman lain atas insiden tersebut.;Mencari cara untuk menghindari bertemu dengan teman tersebut lagi.;Minta maaf kepada temannya dan berkomitmen untuk berhati-hati dengan perkataannya di masa depan.;Mengabaikan perasaan temannya karena merasa tidak bersalah.;Merasa bahwa tindakannya tidak perlu dimaafkan karena itu hanya lelucon","Minta maaf kepada temannya dan berkomitmen untuk berhati-hati dengan perkataannya di masa depan"
13,"Perhatikan ayat berikut. Huruf yang bertanda merah merupakan bacaan………… dibaca dengan cara…………….","Gambar Tanpa Teks;Qalqalah - Memantul;Idzhar - Jelas;Ghunnah - Mendengung;Mad - Panjang","Ghunnah - Mendengung"
14,"Mengapa ikhtiar, doa, dan tawakal harus dilakukan secara bersamaan?","Karena keberhasilan manusia tergantung sepenuhnya pada usaha, doa, dan tawakal.;Semua jawaban salah.;Karena manusia harus menunjukkan kesungguhan dan keikhlasan dalam beribadah.;Karena usaha, doa, dan tawakal merupakan bagian dari keyakinan kepada takdir Allah Swt","Karena usaha, doa, dan tawakal merupakan bagian dari keyakinan kepada takdir Allah Swt"
15,"Huruf di samping berjumlah 1, adalah huruf dari bacaan","Gambar Tanpa Teks;Idgham Bila Ghunnah;Ikhfa;Iqlab;Idgham Bi Ghunnah","Iqlab"
16,"Apa langkah yang dapat dilakukan untuk menjaga lingkungan agar tetap bersih dan terpelihara?","Melakukan pengolahan sampah dan limbah dengan baik.;Tidak melakukan pengolahan tanah.;Membuang sampah sembarangan.;Menggunakan bahan hasil produksi yang tidak ramah lingkungan.;Tidak melakukan penghijauan","Melakukan pengolahan sampah dan limbah dengan baik"
17,"Hal-hal apa saja yang dapat membatalkan puasa?","Makan dan minum dengan sengaja, muntah dengan sengaja, keluar dari ketentuan syarat sah puasa.;Makan dan minum tidak sengaja, muntah dengan sengaja, murtad, keluar dari ketentuan syarat sah puasa.;Makan dan minum tanpa sengaja, keluar dari agama Islam, keluar dari ketentuan syarat sah puasa.;lupa makan dan minum, murtad, keluar dari ketentuan syarat sah puasa","Makan dan minum dengan sengaja, muntah dengan sengaja, keluar dari ketentuan syarat sah puasa"
18,"Apa yang dimaksud dengan Sifat Wajib Allah Swt.?","Sifat yang hanya dimiliki oleh manusia.;Sifat yang tidak ada pada Allah Swt.;Sifat yang dimiliki oleh makhluk.;Sifat yang terbatas pada waktu.;Sifat yang pasti ada pada Allah Swt. dan maha sempurna","Sifat yang pasti ada pada Allah Swt. dan maha sempurna"
19,"Shalat wajib yaitu shalat yang bila dilaksanakan mendapatkan pahala dan bila ditinggalkan mendapatkan Dosa. Di bawah ini yang merupakan shalat wajib yaitu:","Shalat Jumat;Shalat Duha;Shalat Tahajud;Shalat Tarawih","Shalat Jumat"
20,"Huruf di samping berjumlah 4, adalah huruf dari bacaan","Gambar Tanpa Teks;Idgham Bila Ghunnah;Ikhfa;Idzhar;Idgham Bi Ghunnah","Idgham Bi Ghunnah"
21,"Mengapa bangsa Arab sebelum Islam disebut jahiliyah?","Karena mereka menyembah sesuatu yang mereka buat sendiri.;Karena mereka tidak memiliki agama.;Karena mereka tidak memiliki adat dan kebiasaan.;Karena mereka memiliki adat kebiasaan yang buruk seperti membunuh anak perempuan dan suka berkelahi.;Karena mereka tidak memiliki tradisi sastra dan seni","Karena mereka memiliki adat kebiasaan yang buruk seperti membunuh anak perempuan dan suka berkelahi"
22,"Bagaimana pemahaman tentang Asmaul Husna ""Al-Qayyum"" dapat membantu seseorang dalam memelihara amal soleh secara konsisten/terus menerus?","Menyadarkan pentingnya konsistensi dalam amal soleh;Mengajak untuk berperilaku sembarangan dalam amal soleh;Tidak ada hubungan antara ""Al-Qayyum"" dan amal soleh;Membuat seseorang lebih memilih untuk tidak melakukan amal soleh","Menyadarkan pentingnya konsistensi dalam amal soleh"
23,"Bacaan dari huruf yang berwarna merah yaitu………..","Gambar Tanpa Teks;Iqlab;Idzhar;Ikhfa;Idgham Bi Ghunnah","Iqlab"
24,"Bacaan dari huruf yang berwarna pink yaitu………..","Gambar Tanpa Teks;Idgham Bi Ghunnah;Idzhar;Ikhfa;Idgham Bila Ghunnah","Idgham Bi Ghunnah"
25,"Berikut ini yang bukan termasuk ciri-ciri orang munafik adalah ....","Berkhianat.;Selalu menjaga shalat.;Ingkar janji.;Berbohong saat berbicara","Selalu menjaga shalat"
26,"Apa arti dari Asmaulhusna ""Al-Wahhāb""?","Maha Kuasa;Maha Pemberi;Maha Mendengar;Maha Besar;Maha Mengetahui","Maha Pemberi"
27,"Ketika Abu Bakar diberi gelar ""al-Ṣiddiq"" oleh Rasulullah, apa pesan yang ingin disampaikan?","Abu Bakar memiliki kemampuan luar biasa dalam memimpin umat Islam.;Abu Bakar selalu setuju dengan apa pun yang dikatakan Rasulullah.;Abu Bakar adalah orang yang paling populer di antara sahabat Rasulullah.;Abu Bakar adalah orang terkaya di antara sahabat Rasulullah.;Abu Bakar selalu membenarkan dan mempercayai ajaran dan kabar yang disampaikan Rasulullah","Abu Bakar selalu membenarkan dan mempercayai ajaran dan kabar yang disampaikan Rasulullah"
28,"Di bawah ini adalah salah satu ayat surat al-Ma'un ayat....;وَلَا يَحُضُّ عَلَىٰ طَعَامِ الْمِسْكِينِ;4;5;3;6","3"
29,"Tanda baca Al-Qur'an disebut....","hakikat;harokat;baiat;tabiat","harokat"
30,"Ketika seseorang menyadari bahwa manusia adalah khalifah, apa yang seharusnya menjadi tanggung jawab mereka terhadap lingkungan?","Membiarkan lingkungan mengurus dirinya sendiri.;Merusak dan mencemari lingkungan sebanyak mungkin.;Mengabaikan lingkungan karena tidak penting.;Melindungi dan merawat lingkungan agar tetap sehat dan indah","Melindungi dan merawat lingkungan agar tetap sehat dan indah"
31,"Berikut ini yang bukan termasuk contoh perilaku persaudaraan dalam Islam adalah ....","Menghormati orang tua dan guru.;Menolong teman yang sedang kesusahan.;Berbagi makanan dengan teman.;Membicarakan keburukan orang lain","Membicarakan keburukan orang lain"
32,"Mengapa sifat-sifat ini disebut ""Mustahil"" bagi Allah Swt.?","Karena Allah Swt. tidak pernah rusak atau binasa.;Karena sifat-sifat ini tidak ada hubungannya dengan Allah Swt.;Karena sifat-sifat ini adalah kebalikan dari sifat-sifat wajib Allah Swt.;Karena Allah Swt. Maha Sempurna.;Karena Allah Swt. Maha Kuasa","Karena sifat-sifat ini adalah kebalikan dari sifat-sifat wajib Allah Swt"
33,"Di sebuah desa kecil, ada seorang anak muda bernama Ali. Ali selalu berusaha untuk mandiri dalam kehidupannya sejak usia dini. Ia selalu ingin melakukan segalanya sendiri tanpa terlalu bergantung pada bantuan orang lain. Apa manfaat dari sikap Ali tersebut?","Ali selalu bergantung pada teman-temannya untuk melakukan hal-hal kecil.;Ali cenderung tidak memiliki teman karena ia selalu ingin berdiri sendiri.;Ali dapat memotivasi teman-temannya untuk juga menjadi mandiri.;Ali tidak peduli dengan pendapat teman-temannya","Ali dapat memotivasi teman-temannya untuk juga menjadi mandiri"
34,"Lafal berikut ini terdapat dalam Surah;فَذَٰلِكَ الَّذِي يَدُعُّ الْيَتِيمَ;Al-Falaq;Al-Ikhlas;Al-Ma'un;Al-Kafirun","Al-Ma'un"
35,"Berikut ini yang bukan termasuk contoh perilaku mengucapkan salam dengan baik adalah ....","Menjabat tangan orang yang disapa.;Mengucapkan salam dengan suara yang jelas dan tegas.;Memalingkan muka saat mengucapkan salam.;Menundukkan kepala saat mengucapkan salam","Memalingkan muka saat mengucapkan salam"
36,"Rasulullah saw hijrah ke Madinah bersama sahabat-sahabatnya yang disebut kaum muhajirin. Sesampainya di Madinah, Nabi Muhammad mempersaudarakan Kaum Muhajirin dengan Kaum Anshar. Anshar artinya…..","Peminta;Penerima;Penolong;Pemberi","Penolong"
37,"Persaudaraan karena kesamaan agama Islam disebut juga dengan ....","Ukhuwah Basyariyah;Ukhuwah Wathaniyah;Ukhuwah Islamiyah;Ukhuwah Insaniyah","Ukhuwah Islamiyah"
38,"Apa yang dimaksud dengan kalimat ""Insyaallah""?","Jika dikehendaki Allah;Allah Maha Kuasa;Allah Maha Pengasih;Maha Suci Allah;Allah Maha Besar","Jika dikehendaki Allah"
39,"Bagaimana proses penerapan hukum halal dan haram dalam kehidupan sehari-hari dapat membentuk karakter seseorang?","Hanya berlaku bagi mereka yang sudah memiliki karakter yang kuat sebelumnya.;Tidak memiliki dampak signifikan terhadap pembentukan karakter seseorang.;Hanya memengaruhi tindakan seseorang tanpa memengaruhi karakternya.;Dapat membantu seseorang menjadi lebih kritis dalam memilih tindakan dan keputusan.;Membuat seseorang menjadi lebih taat pada perintah agama tanpa mempertimbangkan aspek-aspek lainnya","Dapat membantu seseorang menjadi lebih kritis dalam memilih tindakan dan keputusan"
40,"Apa yang dimaksud dengan sifat ""Adam"" pada Allah Swt.?","Allah Swt. Maha Kuasa.;Allah Swt. Maha Mengetahui.;Allah Swt. tidak pernah rusak atau binasa.;Allah Swt. tidak butuh bantuan apapun.;Allah Swt. tidak mungkin tidak ada","Allah Swt. tidak mungkin tidak ada"
41,"Perhatikan potongan ayat berikut!;.... وَلَا يَحُضّ;Ayat tersebut dibaca……","fawailullilmushallin;tho'amil miskin;wala yahuddhu;fadzalika","wala yahuddhu"
42,"Pesan pokok yang terdapat dalam Surah an-Nas menekankan pada apa?","Kemandirian manusia;Kekuatan fisik manusia;Perlindungan hanya kepada Allah Swt.;Keberanian manusia;Kekayaan materi","Perlindungan hanya kepada Allah Swt"
43,"Di Madinah hiduplah orang-orang yang mempunyai perbedaan tubuh, kulit dan agama. Agar tidak terjadi konflik atau perkelahian, sebagai pemimpin, Nabi Muhammad membuat……","Kantor Polisi;Penjara;Piagam Jakarta;Piagam Madinah","Piagam Madinah"
44,"Apa pesan utama dari potongan ayat ""يَا أَيُّهَا النَّاسُ إِنَّا خَلَقْنَاكُم مِّن ذَكَرٍ وَأُنثَىٰ""?","Manusia diciptakan oleh Allah sebagai makhluk paling mulia.;Manusia diciptakan oleh Allah dari tanah.;Manusia diciptakan oleh Allah dalam bentuk berbagai suku dan bangsa.;Manusia diciptakan oleh Allah sebagai laki-laki atau perempuan","Manusia diciptakan oleh Allah sebagai laki-laki atau perempuan"
45,"Perhatikan ayat Q.S. al-Ma'un berikut!;فَذَٰلِكَ الَّذِي يَدُعُّ الْيَتِيمَ;Menurut ayat di atas, siapakah orang yang celaka…","yang enggan untuk memberi bantuan;orang yang menghardik anak yatim;orang yang lalai dalam shalatnya;yang berbuat riya","orang yang menghardik anak yatim"
46,"Kitab apa yang diturunkan kepada Nabi Dawud sebagai pedoman hidup bagi beliau dan umatnya?","Injil;Zabur;Al-Qur'an;Shahifah;Taurat","Zabur"
47,"Apa yang dimaksud dengan puasa sunah?","Puasa yang tidak membutuhkan niat.;Puasa yang hanya dilakukan pada bulan Ramadan.;Puasa yang hukumnya haram.;Puasa yang dianjurkan tetapi tidak wajib dilakukan.;Puasa yang wajib dilakukan setiap hari","Puasa yang dianjurkan tetapi tidak wajib dilakukan"
48,"Sudah menjadi hal umum, setiap kelompok manusia mempunyai pemimpin. Di dalam kelas ada ketua kelas, di desa ada kepala desa, sampai negara dipimpin oleh presiden. Dari berbagai pemimpin itu, Alloh lah yang menjadi pemimpin dari berbagai pemimpin di dunia maupun di akhirat nanti. Karena Alloh mempunyai sifat......","Al Malik yang berarti Alloh Maha Merajai;Al Quddus yang artinya Alloh Maha Suci;Al Quddus yang artinya Alloh Maha Memimpin;Al Malik yang artinya Alloh Maha Pengasih","Al Malik yang berarti Alloh Maha Merajai"
49,"Mengapa Umar bin Khattab digelari ""Amirul Mukminin""?","Karena dia adalah orang pertama yang memeluk Islam di Makkah.;Karena dia dihormati dan dianggap sebagai pemimpin umat Islam yang memimpin dengan adil.;Karena dia adalah ahli strategi perang yang ulung.;Karena dia dipilih oleh Abu Bakar sebagai khalifah penggantinya.;Karena dia berhasil menaklukkan banyak wilayah untuk Islam","Karena dia dihormati dan dianggap sebagai pemimpin umat Islam yang memimpin dengan adil"
50,"Temanmu yang berbeda agama sedang merayakan hari raya agamanya. Apa yang bisa kamu lakukan untuk menunjukkan sikap toleransi?","Membiarkannya merayakan sendiri tanpa ikut memeriahkan.;Melarangnya merayakan hari raya tersebut di sekolah.;Menanyakan tentang hari raya tersebut dan mengucapkan selamat.;Mengejeknya karena merayakan hari raya yang berbeda","Menanyakan tentang hari raya tersebut dan mengucapkan selamat"
51,"Perhatikan potongan ayat ini، مِنَ ٱلأُولَىٰ mengandung bacaan","Lam Qomariyah;Qolqolah;Lam Syamsiah;Ghunnah","Lam Syamsiah"
52,"Apa yang menjadi keistimewaan Nabi Muhammad saw. ketika meletakkan hajar aswad?","Dia melakukannya tanpa ada yang menyadari keberadaannya.;Dia mengusir pemimpin kabilah yang ingin ikut membantu.;Dia mendapatkan gelar ""al-Āmin"" yang berarti dapat dipercaya.;Dia meletakkan hajar aswad tanpa bantuan orang lain.;Dia menolak bantuan orang lain untuk meletakkan hajar aswad","Dia mendapatkan gelar ""al-Āmin"" yang berarti dapat dipercaya"
53,"Hari itu, di taman bermain, Rina kehilangan bonekanya yang sangat disukainya. Temannya, Faisal, menemukan boneka tersebut di semak-semak. Faisal tidak ragu untuk segera mengembalikan boneka itu kepada Rina. Rina sangat senang dan berterima kasih kepada Faisal. Apa yang dapat dihubungkan dengan sifat Sidik dari kisah Faisal?","
